{
  "$schema": "https://spider12223.github.io/SAM-Framework/schemas/mod.schema.json",
  "namespace": "bossexample",
  "name": "Boss Example",
  "author": "S.A.M Framework",
  "version": "1.0.0",
  "framework_min_version": "1.9.0",
  "description": "A complete custom-model boss: its own body, boss presentation, three phases, a telegraphed breath attack, adds, and a loot drop. Copy this folder, rename the namespace, swap the .vox.",

  "models": [
    { "id": "bossexample:wyvern", "file": "models/wyvern.vox" }
  ],
  "monsters": [ "monsters/wyvern.json" ],
  "spells":   [ "spells/searing_breath.json" ],
  "items":    [ "items/wyvern_scale.json", "items/wyvern_blade.json" ]
}
